ASIN,date,author,title,rating,body,helpful
B0723FXC74,27 Mar 2018,Andrew Hebert,Great cutting boards!,5.0 ,Great product. Would recommend to all!,
B0723FXC74,27 Mar 2018,Amazon Customer,Five Stars,5.0 ,"really liked them, haven't stain so far so thats good.",
B0723FXC74,25 Mar 2018,RT,Excellent product,5.0 ,Non-slip grip on bottom with handles makes it easy to use.,
B0723FXC74,24 Mar 2018,db,Five Stars,5.0 ,great addition to the home kitchen,
B0723FXC74,23 Mar 2018,Diana Carlos,Five Stars,5.0 ,Exactly what I was looking for.,
B0723FXC74,23 Mar 2018,unhappy,Five Stars,5.0 ,goog,
B0723FXC74,22 Mar 2018,N. Johns,Excellent cutting boards,5.0 ,Christmas gift and great to have three sizes for cutting.,
B0723FXC74,21 Mar 2018,DLH,I like these boards,5.0 ,I like these boards. I don't use the large one that much but I do use the small and medium quite a bit,
B016OP6N3M,06 Apr 2018,Fuzzyx,High quality!!,5.0 ,"These bamboo set has very high quality! They have appropriate sizes for me to deal with the raws. I used the smallest one for spices, medium for meat, and the largest for vegs and fruits! Also they have beautiful bamboo smell when I firstly opened the pack, felt natural and healthy :)",
B016OP6N3M,06 Apr 2018,Ebony Savage,Five Stars,5.0 ,Great price and quality,
B016OP6N3M,05 Apr 2018,WEN,"Good quality, but the size is relatively small",5.0 ,"Good quality, but the size is relatively small, is a natural bamboo products! Very environmentally friendly, the overall shape is great!",
B016OP6N3M,05 Apr 2018,Shanshan Huang,Useful,5.0 ,These set of 3 cutting boards are good quality and very useful. I'm happy with my purchase.,
B016OP6N3M,05 Apr 2018,Melissa,good quality! I like the idea of three different ...,5.0 ,"good quality! I like the idea of three different size cutting boards in a combos, so I can separate it for different use. I use the big one for raw meat and vegetables. The medium one for cooked meat, and the small one for fruits or salads.",2 people found this helpful.
B016OP6N3M,05 Apr 2018,Ycarolina,I like this set bamboo board,5.0 ,"I like this set bamboo board. It is perfect for use small board for cheese, medium vegetables. It is real bamboo. They are thin and no heavy. They are practical.",
B016OP6N3M,05 Apr 2018,jimmy L,Five Stars,5.0 ,Very useful,
B016OP6N3M,04 Apr 2018,Abby M,Poor quality,1.0 ,All of the boards warped and split after the first use.,
B016OP6N3M,04 Apr 2018,martin j,Three Stars,3.0 ,Might be ok for a clild--Thought it would be bigger !,
B016OP6N3M,04 Apr 2018,Jessica Langlois,"Nice quality, smaller than I thought (but that's on ...",4.0 ,"Nice quality, smaller than I thought (but that's on me as the sizes were listed). Thin, light. I don't expect they will last more than a year or two (we cook a lot), but they were cheap enough and I good gift for my husband.Not a bad idea to oil them and make sure they don't soak in water.",
B016OP6N3M,03 Apr 2018,Debbie K,Five Stars,5.0 ,"Great product and price - sustainable, recyclable…superior to others I have tried.",
B016OP6N3M,03 Apr 2018,Tbrow,Nice boards,4.0 ,Nice quality but will need oiled,
B016OP6N3M,01 Apr 2018,Amazon Customer,Happy To Get It Right,5.0 ,A perfect fit for my wife’s new cutting board rack. Clean lines and the right sized boards for her needs. She was very surprised and that was okay by me. I love it when I get it right.,One person found this helpful.
B016OP6N3M,01 Apr 2018,chunhua,It also has a recommendation about which board is good for what kind of food,5.0 ,"Light in weight with various sizes. It also has a recommendation about which board is good for what kind of food. Thus, along with my another big board,I can cut the meat, vegges and fruit ,cooked or raw,seperately. Only thing is that it will be much better if the large one could be larger.",
B016OP6N3M,31 Mar 2018,CAC,I was looking fr something small that would not take ...,5.0 ,I was looking fr something small that would not take up a lot of counter space in studio apartment. It is just what my daughter needed.,
B016OP6N3M,30 Mar 2018,Abel,BAMBOO is great natural material for chopping since it won't get moldy as wood.,4.0 ,Having marks at oneside so it is easy to distinguish which side is usually used as upper side. No smell. BAMBOO is great natural material for chopping since it won't get moldy as wood. The bigger two could be hanged to dry. And I wish the smallest one could be too.,
B016OP6N3M,30 Mar 2018,Nichole Pelaez,Five Stars,5.0 ,Very good quality!,
B016OP6N3M,28 Mar 2018,Anna Kim,Beware of splinters when opening,1.0 ,Pricked me the moment I opened it. Will be returning and wouldn't recommend to anyone.,
B016OP6N3M,27 Mar 2018,joann chen,Five Stars,5.0 ,This bamboo cutting board is very good and easy clean. Will recommend this product .,
B016OP6N3M,27 Mar 2018,Yan,great cutting board,5.0 ,"I love chopping on my bamboo boards.With the different sizes, I can use them for difference food(veggies,meat, and bread or cheese ).Having 3 of them is perfect so I don’t cross contaminate. It says dishwasher safe, so maybe I just got a bad one. I love these way more than the plastic one I was using. High quality and a great price.",
B016OP6N3M,27 Mar 2018,Amazon Customer,I am in love with these cutting boards,5.0 ,I am in love with these cutting boards! I have already used and washed these multiple times since I got them. They are perfect size and very smooth.,
B016OP6N3M,26 Mar 2018,Michael Sankovich,and they are very nice to cut against and seem very durable,5.0 ,"They arrived promptly and I immediately started using them. The different sizes are very convenient, and they are very nice to cut against and seem very durable. Even better, they are easy as hell to clean.",
B016OP6N3M,25 Mar 2018,Christopher,Good value for the Price,4.0 ,"Nice 3 piece set that serve their purpose for the price point. I am a bit concerned about their long term durability though. Only used a few times and there are some pretty hefty cut marks in these boards. For $10 though, it is what it is.",
B016OP6N3M,25 Mar 2018,Lily Hiddemen,The small bamboo cutting board is perfect for small cooking projects,5.0 ,"I am not a fan of plastic cutting boards, so while the green one came with the bamboo cutting board, I use the bamboo cutting board more than the plastic one. The small bamboo cutting board is perfect for small cooking projects, such as cutting up garlic or onion. I like it because sometimes I cook for myself and have no need to dirty my large bamboo cutting board. It's light, versatile and well made and perfect when a person is cooking for one. 5 stars for the bamboo!",
B016OP6N3M,25 Mar 2018,Allen Moredock,Very nice boards,5.0 ,Very nice quality... Very sturdy but surprisingly light. I would definitely buy these again.,
B016OP6N3M,24 Mar 2018,Michael Wagner,Five Stars,5.0 ,Wonderful product,
B016OP6N3M,23 Mar 2018,Ethan,"the bamboo board is cool, my mum likes it very much",5.0 ,"3 in 1, the bamboo board is cool, my mum likes it very much.",One person found this helpful.
B016OP6N3M,21 Mar 2018,J. C.,Convenient and healthier.,5.0 ,"It's healthier when I separate the bamboo cutting board for meat, vegetable and fruits. The bamboo quality is great that they are light weight but durable. Especially the two bigger size, they are convenient to cut stuffs.",
B016OP6N3M,20 Mar 2018,xiaorenjing888,The bamboo cutting is very good. I will one for meet,5.0 ,"The bamboo cutting is very good. I will one for meet,one for vegtable one for fruit. Everything is perfect.The seller is nice. Now I will learn cook with my cutting !",
B016OP6N3M,20 Mar 2018,jie jie lin,Five Stars,5.0 ,Great quality.,
B016OP6N3M,20 Mar 2018,Germonson,As good as I expected,5.0 ,"As good as I expected, cutting things did not move. A very good bamboo cutting board better than plastic cutting board.",
B016OP6N3M,19 Mar 2018,Jian,and better than my old plastic one,5.0 ,"First, Arrived really fast. First time trying bamboo cutting board. So far, no complaints. Solid, light, and better than my old plastic one.",
B016OP6N3M,18 Mar 2018,al lengkeek,Five Stars,5.0 ,Love these boards. Great as a cutting board or cheese board.,
B016OP6N3M,18 Mar 2018,Doodle™,Didnt last long.,2.0 ,Lasted about 2 months before they started curling up. Cracked and broke shortly after. Buy a thicker cutting board.,
B016OP6N3M,18 Mar 2018,Amazon Customer,Pieces of wood in my food,1.0 ,Pieces of wood are shedding off all three boards. Not a good purchase,One person found this helpful.
B016OP6N3M,17 Mar 2018,Chong L.,So much better than plastic cutting boards,5.0 ,"I have a big size bamboo cutting board and was looking for a set of small boards for cheese, small size veggies, and stuff. So I ordered this and I have to say I like it very much. They are very light and strong due to the nature of bamboo. They are reversible, too. And in my experience, bamboo is naturally anti-microbial. I have been staying away from plastic cutting boards for years and I will never go back. These are easy to clean and I conditioned them with mineral oil for a day and the shine and finish seems to last. I'm certain that these will last for a long long time.",2 people found this helpful.
B016OP6N3M,17 Mar 2018,Paige Morgan,Edges started to grow mold. Buyer beware!,1.0 ,"These look nice, but the edges have started turning black with some sort of fungus after just a few weeks use. I don't think they were sealed like the other surfaces.",2 people found this helpful.
B016OP6N3M,17 Mar 2018,Tessa Franklin,Great product,5.0 ,"Great cutting board set. Exactly as advertised. I would definitely recommend oiling them with mineral oil, though.",
B016OP6N3M,17 Mar 2018,Lorraine Uckerman,once I prep it with oil or the like..,5.0 ,"About to use this soon, once I prep it with oil or the like..",
B016OP6N3M,15 Mar 2018,Here We Are Again,Cracked!,1.0 ,One of the boards had a crack running through the middle,One person found this helpful.
B016OP6N3M,15 Mar 2018,Wendy,Very pleased!,5.0 ,"I love these, but I do really love the largest in this set and that's the one I use. The small is very small, it was tedious to chop a small zucchini on it, but the quality is amazing and they clean up well and shipped amazingly fast and overall very, very pleased.",
B016OP6N3M,15 Mar 2018,Devin,Rough and full of splinters,2.0 ,"Boards are full of splinters and rough edges. Sizes and weight are nice, but I'm going to have to sand and oil before even considering using. Id recommend just spending more for better quality boards.",
B016OP6N3M,13 Mar 2018,Regina I,Highly recommended for mama!,5.0 ,"First time using bamboo kind cutting board. This was easy to clean and cut better than the plastic one in the past. It comes with three different sizes which I can Better separate for fresh, raw and fruits.",One person found this helpful.
B016OP6N3M,12 Mar 2018,Gz,I don’t like plastic ones and the bamboo board seems better than ...,5.0 ,Three light weight and durable cutting boards for only 11 dollars! I don’t like plastic ones and the bamboo board seems better than wood. The smooth surface makes it easy to clean. Quality products!,
B016OP6N3M,12 Mar 2018,John O'Donnell,Five Stars,5.0 ,Like the items. Good price.,
B016OP6N3M,12 Mar 2018,JC,Great size overall but came with some splinters that took ...,3.0 ,Great size overall but came with some splinters that took a while and some washing to finally go away. OK durability and nice coloring. Nothing too fancy but light and convenient for every day use.,
B016OP6N3M,09 Mar 2018,Karrie L Smith,Four Stars,4.0 ,Not the best quality but they'll do.,
B016OP6N3M,09 Mar 2018,Amiee C.,I was so pleased to have found this item,5.0 ,I was so pleased to have found this item. I like that that the three sizes are included together so you have multiple option when cutting in the kitchen. I also love how beautiful these cutting boards looks. They are lightweight and great quality that i can use the cutting boards a very long time.,
B016OP6N3M,08 Mar 2018,Stephanie,Its fine,3.0 ,Work great but largest board has already cracked after a few months of light use.,
B016OP6N3M,07 Mar 2018,Jim,Light and easy to store.,5.0 ,Our old cutting boarding is made of plastic. very heavy and its big 16x24. We like this 3 pcs set bamboo cutting board. They are light and sizes are easy to store and even fit in the dish rack for drying.,
B016OP6N3M,07 Mar 2018,Amazon Customer,Not happy...,2.0 ,"I was very excited about these when I received them, but unfortunately after one use, they started bending and deforming. Had to toss them since they slide on the counter too...",
B016OP6N3M,06 Mar 2018,Karen Bruce,good quality,5.0 ,"this is a very good quality of bamboo and they came on time , i am very pleased with them",
B016OP6N3M,06 Mar 2018,discoveringbooks,So versatile. I used one as a cup coaster ...,5.0 ,"So versatile. I used one as a cup coaster on my study desk, one to serve sushi etc. on, and the other to chop vegetables on. Win-win.",
B016OP6N3M,05 Mar 2018,FIONA,Each chopping board has its purpose. I cut the ...,5.0 ,Each chopping board has its purpose. I cut the minced garlic with the smallest one. The largest meat and vegetables. Then cut the medium fruit. perfect。,
B016OP6N3M,04 Mar 2018,tracy chen,i really like it because it contains three sizes,5.0 ,i just bought this set of cutting boards last week. i really like it because it contains three sizes. sometimes i only have little things to cut so i just use the smallest one. also i can use different cutting boards for seprating meat and vegetable. the quality for this cutting boards is pretty good for this pricing. it is very convenient because of different sizes.,
B016OP6N3M,04 Mar 2018,Hemalatha,"Small, thin and good quality for low price",4.0 ,I was expecting big and thick boards based on the images posted whereas it is small and thin. It is good and sturdy. Good quality for the price,
B016OP6N3M,04 Mar 2018,Avi,Five Stars,5.0 ,Great Product as Described,
B016OP6N3M,02 Mar 2018,Danny,No issues so far—does its job well for a good price and looks good while doing it,5.0 ,"Follow the care instructions and make sure you seal it with oil, and this cutting board will last a long time. No issues so far—does its job well for a good price and looks good while doing it.",
B016OP6N3M,01 Mar 2018,HW,It seems like a very made product,3.0 ,"It seems like a very made product, but unfortunately the size is too small even for the largest one, thus had to return it",
B016OP6N3M,01 Mar 2018,Karen,Just received this today but I am rather disappointed.. all the boards are shedding tiny wood ...,1.0 ,Just received this today but I am rather disappointed.. all the boards are shedding tiny wood pieces so I’m gonna have to return these:/,2 people found this helpful.
B0723FXC74,06 Apr 2018,Just Lisa,I love my new cutting boards,5.0 ,I love my new cutting boards. The set of 3 is perfect for all my needs. I love the groove that catches any liquids and the color is neutral so it would match any decor. I highly recommend and would purchase again.,
B0723FXC74,05 Apr 2018,jjjacob,Three Stars,3.0 ,Smaller boards than anticipated.,
B0723FXC74,04 Apr 2018,Ellie,Four Stars,4.0 ,"Smaller than I thought they'd be, but quality is what I expected.",
B0723FXC74,02 Apr 2018,J. Gold,Nice looking cutting boards,5.0 ,They arrived ahead of schedule and are as advertised. So far they work great!,
B0723FXC74,01 Apr 2018,Margarita,Four Stars,4.0 ,Basic cutting boards. Does the job.,
B0723FXC74,30 Mar 2018,Kathy E.,Five Stars,5.0 ,"Love my new cutting boards. They got here in a timely manner, thank you.",
B0723FXC74,29 Mar 2018,M. Powell,Two Stars,2.0 ,"Not holding up as I'd like, but okay",
B0723FXC74,29 Mar 2018,L. Verni,Too small to be useful,1.0 ,"I was excited about these cutting boards, as I have similar ones with the rubber that prevents them from sliding, but these have a small channel to catch juices as you cut. However, they are SO SMALL, it's ridiculous! I have no idea who could actually cook dinner using the small or medium one. The ""large"" is one I'd pull out if I was just slicing cheese. I could never use these to cut up chicken or anything larger that I don't want to go off the edge of the board onto the counter. Wish I wasn't so lazy or I'd return them.",One person found this helpful.
B0723FXC74,29 Mar 2018,Brandon,They are fine for the price,3.0 ,They are fine for the price. Have gone through one dishwasher cycle so far. They do slide around quite a bit. If you have the grooved side up there is no grip at all and it will slide all over on you.,
B0723FXC74,29 Mar 2018,Jessica Froelich,Nice Buy,5.0 ,Works great. Love the three different sizes. Easy to clean.,
B0723FXC74,06 Apr 2018,Just Lisa,I love my new cutting boards,5.0 ,I love my new cutting boards. The set of 3 is perfect for all my needs. I love the groove that catches any liquids and the color is neutral so it would match any decor. I highly recommend and would purchase again.,
B0723FXC74,05 Apr 2018,jjjacob,Three Stars,3.0 ,Smaller boards than anticipated.,
B0723FXC74,04 Apr 2018,Ellie,Four Stars,4.0 ,"Smaller than I thought they'd be, but quality is what I expected.",
B0723FXC74,02 Apr 2018,J. Gold,Nice looking cutting boards,5.0 ,They arrived ahead of schedule and are as advertised. So far they work great!,
B0723FXC74,01 Apr 2018,Margarita,Four Stars,4.0 ,Basic cutting boards. Does the job.,
B0723FXC74,30 Mar 2018,Kathy E.,Five Stars,5.0 ,"Love my new cutting boards. They got here in a timely manner, thank you.",
B0723FXC74,29 Mar 2018,M. Powell,Two Stars,2.0 ,"Not holding up as I'd like, but okay",
B0723FXC74,29 Mar 2018,L. Verni,Too small to be useful,1.0 ,"I was excited about these cutting boards, as I have similar ones with the rubber that prevents them from sliding, but these have a small channel to catch juices as you cut. However, they are SO SMALL, it's ridiculous! I have no idea who could actually cook dinner using the small or medium one. The ""large"" is one I'd pull out if I was just slicing cheese. I could never use these to cut up chicken or anything larger that I don't want to go off the edge of the board onto the counter. Wish I wasn't so lazy or I'd return them.",One person found this helpful.
B0723FXC74,29 Mar 2018,Brandon,They are fine for the price,3.0 ,They are fine for the price. Have gone through one dishwasher cycle so far. They do slide around quite a bit. If you have the grooved side up there is no grip at all and it will slide all over on you.,
B0723FXC74,29 Mar 2018,Jessica Froelich,Nice Buy,5.0 ,Works great. Love the three different sizes. Easy to clean.,
B0723FXC74,28 Mar 2018,Aimee R.,Not non slip,1.0 ,"The cutting board slide all over the place. I was hoping the reviews that said they slide were wrong, sadly they were correct. Keep looking, this cutting board is not for you.",
B0723FXC74,27 Mar 2018,James Biehl,Good quality,5.0 ,Exactly what was advertised. Three sizes are included and they're all very durable,
B0723FXC74,27 Mar 2018,Andrew Hebert,Great cutting boards!,5.0 ,Great product. Would recommend to all!,
B0723FXC74,27 Mar 2018,Amazon Customer,Five Stars,5.0 ,"really liked them, haven't stain so far so thats good.",
B0723FXC74,25 Mar 2018,RT,Excellent product,5.0 ,Non-slip grip on bottom with handles makes it easy to use.,
B0723FXC74,24 Mar 2018,db,Five Stars,5.0 ,great addition to the home kitchen,
B0723FXC74,23 Mar 2018,Diana Carlos,Five Stars,5.0 ,Exactly what I was looking for.,
B0723FXC74,23 Mar 2018,unhappy,Five Stars,5.0 ,goog,
B0723FXC74,22 Mar 2018,N. Johns,Excellent cutting boards,5.0 ,Christmas gift and great to have three sizes for cutting.,
B0723FXC74,21 Mar 2018,DLH,I like these boards,5.0 ,I like these boards. I don't use the large one that much but I do use the small and medium quite a bit,
